"item","story_type","description","sequence_clarity","agency_clarity","causal_connection","conflict_definition","transformation_clarity","motif_use","interpretive_relevance","evidence_strength","representation_care","persuasive_intensity","audience_consequence","owner","status","coherence_score","craft_score","governance_risk","review_priority"
"Campaign persuasion narrative","public narrative","Frames urgency agency obstacle and collective action",0.72,0.74,0.66,0.8,0.7,0.62,0.76,0.56,0.54,0.88,0.86,"communications","revise",0.716,0.72,0.618,"high"
"Personal transformation case","life narrative","Uses memory conflict and change to explain identity",0.76,0.8,0.7,0.72,0.86,0.58,0.82,0.68,0.62,0.74,0.78,"research","review",0.788,0.748,0.514,"high"
"Origin story article opening","institutional narrative","Explains founding purpose and public meaning",0.82,0.78,0.74,0.68,0.76,0.64,0.84,0.78,0.72,0.58,0.66,"editorial","active",0.788,0.748,0.398,"medium"
"Folktale motif inventory","traditional story","Tracks recurring figures objects thresholds and reversals",0.84,0.7,0.76,0.68,0.78,0.9,0.8,0.74,0.7,0.42,0.48,"archive","active",0.776,0.8,0.348,"medium"
"Ethical representation note","governance artifact","Documents voice context consent and representation cautions",0.68,0.72,0.64,0.6,0.66,0.54,0.78,0.82,0.88,0.46,0.7,"governance","active",0.696,0.652,0.322,"standard"
