item,primary_memory_function,secondary_memory_function,continuity_note
Epic performance,identity memory,historical and heroic memory,Maintains public story-world and values
Ritual chant documentation,ritual memory,origin and obligation memory,Renews ceremonial continuity
Community place story,place memory,identity and future obligation,Connects memory to landscape and community responsibility
Platform remix of traditional story,fragmented memory,visibility without governance,Continuity is weakened by context loss
Family memory story,identity memory,family history and emotional memory,Maintains family meaning across generations
