item,performance_context,teller,audience,occasion,setting_note
Epic performance,public oral epic performance,specialist singer,community gathering,ceremonial or festive event,Performance context includes formula and audience response
Ritual chant documentation,ritual speech context,authorized ritual speaker,restricted or initiated audience,ceremonial timing,Documentation requires access protocol
Community place story,place-based memory telling,elder or local knowledge holder,community and learners,site-based teaching,Place is part of meaning
Platform remix of traditional story,digital adaptation,unknown remix creator,platform viewers,online circulation,Context and permission unclear
Family memory story,family oral history,family member,kinship audience,gathering or interview,Memory and interpretation are linked
