item,story_type,description,sequence_clarity,agency_clarity,causal_connection,conflict_definition,transformation_clarity,motif_use,interpretive_relevance,evidence_strength,representation_care,persuasive_intensity,audience_consequence,owner,status
Origin story article opening,institutional narrative,Explains founding purpose and public meaning,0.82,0.78,0.74,0.68,0.76,0.64,0.84,0.78,0.72,0.58,0.66,editorial,active
Personal transformation case,life narrative,Uses memory conflict and change to explain identity,0.76,0.80,0.70,0.72,0.86,0.58,0.82,0.68,0.62,0.74,0.78,research,review
Campaign persuasion narrative,public narrative,Frames urgency agency obstacle and collective action,0.72,0.74,0.66,0.80,0.70,0.62,0.76,0.56,0.54,0.88,0.86,communications,revise
Folktale motif inventory,traditional story,Tracks recurring figures objects thresholds and reversals,0.84,0.70,0.76,0.68,0.78,0.90,0.80,0.74,0.70,0.42,0.48,archive,active
Ethical representation note,governance artifact,Documents voice context consent and representation cautions,0.68,0.72,0.64,0.60,0.66,0.54,0.78,0.82,0.88,0.46,0.70,governance,active
