item,risk_type,severity,note
Corporate hero narrative,stage literalism,high,Hero journey is used as a brand template
Corporate hero narrative,context loss,high,Institutional power is hidden by transformation language
Corporate hero narrative,universal claim,high,Brand story treats hero model as universal truth
Coming-of-age film,formula drift,medium,Hero's journey stages may become mechanical plot matching
Memoir of recovery,romanticized suffering,medium,Harm should not be reframed as necessary growth
Collective movement story,hero centrality,medium,Collective labor may be reduced to one leader
Quest narrative,selective evidence,low,Include counterexamples and ritual context
