item,claim_context,temporal_rupture,gap_marking,repetition_patterning,silence_respect,uncertainty_notes,contextual_care,consent,agency,privacy,relational_context,safety_framing,boundary_discipline,forced_coherence,redemptive_shortcut,extraction_risk,identity_reduction,spectacle_pressure,method_limits,source_context,cultural_context,ethics_governance,review_owner_clarity,public_consequence,owner,status,notes
Survivor testimony,fragmented witness memory and consent audit,0.88,0.82,0.84,0.90,0.86,0.84,0.88,0.84,0.86,0.82,0.90,0.88,0.42,0.46,0.58,0.48,0.52,0.84,0.86,0.84,0.90,0.86,0.92,ethics review,review,Protect witness dignity and avoid forcing complete chronology.
Institutional apology,closure language accountability and public repair audit,0.66,0.62,0.58,0.60,0.68,0.64,0.52,0.58,0.50,0.60,0.56,0.54,0.82,0.76,0.72,0.70,0.62,0.66,0.72,0.70,0.82,0.78,0.90,governance,revise,Escalate premature closure and institutional self-protection.
Nonlinear trauma memoir,memory gaps repetition and narrative form audit,0.90,0.86,0.88,0.82,0.84,0.82,0.78,0.80,0.76,0.82,0.80,0.78,0.40,0.48,0.44,0.46,0.42,0.82,0.84,0.82,0.86,0.84,0.78,editorial,active,Strong formal fragmentation with standard ethical review.
Family silence,intergenerational memory silence and inherited trauma audit,0.78,0.86,0.72,0.88,0.82,0.84,0.76,0.74,0.78,0.86,0.82,0.84,0.44,0.40,0.50,0.46,0.38,0.80,0.82,0.88,0.86,0.82,0.76,editorial,active,Review silence as relational historical and protective rather than empty.
Digital trauma circulation,viral testimony context collapse and platform risk audit,0.72,0.70,0.66,0.78,0.76,0.74,0.58,0.62,0.56,0.60,0.64,0.62,0.68,0.54,0.86,0.70,0.88,0.76,0.78,0.76,0.90,0.86,0.94,governance,review,Review consent reuse harassment algorithmic amplification and context collapse.
