item,causal_claim,evidence_strength,causal_risk
Personal recovery narrative,Recovery followed sustained support and reinterpretation,medium,Sequence may be simplified
Institutional failure account,Failure emerged from ignored warnings and weak governance,medium,Structural causes need documentation
Public crisis story,Crisis was caused by a single decision,low,Overpersonalized blame
Scenario planning story,Future outcome depends on specified assumptions,medium,Scenario may be read as prediction
Cultural memory account,Present identity is shaped by inherited memory,medium,Memory may be treated as fixed
