"item","opening_type","opening_promise","orientation_note","risk_note","ending_type","closure_form","alignment_note"
"Circular literary ending","threshold beginning","transformation through return","Opening image anchors the structure","Return must change meaning","circular ending","return with transformation","Opening motif returns with altered meaning"
"Institutional apology ending","crisis beginning","public accountability and repair","Stakes are visible but institutional agency is vague","Closure may arrive too early","official apology","false-closure risk","Beginning promise of accountability is not fully answered"
"Memoir opening and reflective ending","retrospective beginning","memory and reflective transformation","Voice and memory distance are established","Memory limits should stay visible","reflective ending","partial closure through later understanding","Opening memory returns through changed interpretation"
"Open trauma narrative","fragmented beginning","partial memory and unresolved consequence","Disorientation is purposeful","Do not force complete coherence","open ending","ethical openness","Unresolved aftermath is part of the meaning"
"Serial cliffhanger episode","in medias res","continuation through pressure","Immediate pressure is clear","May overuse withholding","serial ending","arc partial closure plus continuation","Continuation outweighs closure"
