"item","reversal_type","what_turns","preparation_note","recognition_event","recognition_object","evidence_type","uncertainty_note"
"Delayed memory recognition","retrospective reversal","past memory changes present meaning","Fragments and repetitions prepare recognition","recovered pattern","memory and cause","fragmented recollection","Partial but meaningful"
"Institutional acknowledgment","legitimacy reversal","authority becomes accountable","Documents and testimony prepare the turn","public report","harm and responsibility","documents and testimony","Further reform evidence needed"
"Shock twist ending","arbitrary twist","identity premise changes","Preparation is too thin","late reveal","hidden identity","authorial claim","Weak support"
"Tragic recognition","knowledge reversal","assumption becomes responsibility","Prior action leaves meaningful traces","identity discovery","self and relation","action pattern","High clarity"
"Viral false recognition","false public turn","clip appears to reveal truth","Context is missing and risk is high","viral clip","apparent blame","thin platform evidence","High uncertainty"
