item,reversal_type,recognition_type,preparation_strength,consequence_note
Unified tragic action,reversal of fortune,identity recognition,high,Recognition transforms the action
Episodic adventure sequence,episodic surprise,limited discovery,low,Surprise is weakly integrated
Formulaic hero template,expected template reversal,self-realization,medium,Recognition risks predictability
Fragmented memory narrative,interpretive reversal,memory recognition,high,Recognition reframes earlier fragments
Plot-heavy spectacle,visual reversal,thin recognition,low,Turn depends more on spectacle than knowledge
