item,claim_context,pattern_strength,rupture_renewal_strength,ethical_risk,interpretation_readiness,governance_priority_score,review_priority,owner,status,governance_note
Institutional renewal story,founding crisis mission loss and reform,0.745,0.7,0.5912,0.6967,0.62,high,governance,revise,"High-priority narrative-pattern governance review required. Ethical risk is elevated; review origin nostalgia, cleansing fantasy, exile romanticization, false return, and power blindness. High governance concern when renewal hides institutional harm."
Flood and renewal,catastrophe survival and covenant pattern,0.64,0.755,0.4132,0.7867,0.45,medium,ethics review,review,Medium-priority review recommended before reuse. Review cleansing language and catastrophe framing.
Exile and return,displacement memory and contested restoration,0.685,0.81,0.458,0.83,0.45,medium,governance,review,Medium-priority review recommended before reuse. Review land memory displacement and false return.
Climate displacement story,ecological rupture exile and uncertain return,0.7,0.84,0.436,0.84,0.45,medium,climate ethics,review,Medium-priority review recommended before reuse. Keep material systems and unequal exposure visible.
Creation narrative,origin and world-order pattern,0.455,0.475,0.2828,0.7667,0.3335,standard,editorial,active,Standard editorial review sufficient. Preserve origin context and avoid nostalgia.
