item,authority_issue,access_level,governance_note
Proverb in conflict mediation,situational elder or speaker authority,public or situational,Context affects interpretation
Work song,performer and community authority,community-approved public or restricted,Review recording and reuse
Ceremonial chant,ritual specialist or community authority,restricted,Do not publish without cultural review
Funerary lament,family community or ritual authority,sensitive,Review privacy names and mourning context
Ritual phrase used in marketing,authority absent or unclear,commercialized,High-risk adaptation requiring revision
