"item","context_type","performance_setting","documentation_note","sound_feature","repetition_feature","interpretive_note","authority_issue","access_level","governance_note"
"Ceremonial chant","ritual chant","ceremonial setting","Review access restrictions and ritual protocol","cadence and collective rhythm","formal ritual repetition","Repetition creates ritual force","ritual specialist or community authority","restricted","Do not publish without cultural review"
"Funerary lament","ritual speech","mourning or funeral context","Document names grief praise and public memory carefully","voice pitch pause and rhythm","names praise and repeated grief formulas","Embodiment carries emotional meaning","family community or ritual authority","sensitive","Review privacy names and mourning context"
"Proverb in conflict mediation","proverb use","conflict mediation or advice setting","Document speaker audience and social action","cadence and metaphor","repeated inherited saying","Compression matters more than melody","situational elder or speaker authority","public or situational","Context affects interpretation"
"Ritual phrase used in marketing","adaptation","commercial media","Review extraction authority and harm","stylized quotation","brand repetition","Sound and ritual force are extracted","authority absent or unclear","commercialized","High-risk adaptation requiring revision"
"Work song","song performance","labor or coordinated work setting","Document rhythm labor relation and participation","melody rhythm and pulse","refrain and work-cycle repetition","Sound coordinates labor and memory","performer and community authority","community-approved public or restricted","Review recording and reuse"
