"item","reversal_type","recognition_type","preparation_strength","consequence_note","severity_score"
"Episodic adventure sequence","episodic surprise","limited discovery","low","Surprise is weakly integrated",2
"Formulaic hero template","expected template reversal","self-realization","medium","Recognition risks predictability",6
"Fragmented memory narrative","interpretive reversal","memory recognition","high","Recognition reframes earlier fragments",1
"Plot-heavy spectacle","visual reversal","thin recognition","low","Turn depends more on spectacle than knowledge",2
"Unified tragic action","reversal of fortune","identity recognition","high","Recognition transforms the action",1
