item,claim_context,heroine_alignment,framework_risk,critique_readiness,integration_quality,governance_priority_score,review_priority,owner,status,governance_note
Universal heroine template,gender essentialism and template forcing audit,0.6467,0.7812,0.6067,0.58,0.6469,high,governance,revise,"High-priority heroine-journey governance review required. Framework risk is elevated; review template forcing, gender essentialism, universal womanhood assumptions, psychological overreach, healing pressure, and cultural context. Critique readiness is limited; strengthen source context, cultural context, alternative lenses, gender-complexity notes, uncertainty notes, and review ownership. Integration quality is limited; review whether wholeness is claimed too quickly or agency, relationship, embodiment, healthy power, emotional maturity, and open process remain underdeveloped. Escalate universal womanhood and gender-essentialist assumptions."
Wellness content summary,commercial empowerment and healing pressure audit,0.6167,0.7668,0.6,0.5733,0.6282,high,governance,review,"High-priority heroine-journey governance review required. Framework risk is elevated; review template forcing, gender essentialism, universal womanhood assumptions, psychological overreach, healing pressure, and cultural context. Critique readiness is limited; strengthen source context, cultural context, alternative lenses, gender-complexity notes, uncertainty notes, and review ownership. Integration quality is limited; review whether wholeness is claimed too quickly or agency, relationship, embodiment, healthy power, emotional maturity, and open process remain underdeveloped. Review motivational simplification and archetypal overclaiming."
AI story classifier,automated stage assignment and uncertainty audit,0.6367,0.6808,0.7,0.62,0.5711,medium,governance,review,"Medium-priority review recommended before reuse. Framework risk is elevated; review template forcing, gender essentialism, universal womanhood assumptions, psychological overreach, healing pressure, and cultural context. Review automated stage assignment uncertainty and alternative frameworks."
Mother-daughter memoir,lineage wound healing and relational complexity audit,0.79,0.4884,0.8167,0.7933,0.45,medium,ethics review,review,Medium-priority review recommended before reuse. Preserve mother as full person; avoid forced reconciliation.
Career memoir,achievement aridity descent and integration audit,0.8067,0.3576,0.83,0.7733,0.3735,standard,editorial,active,Standard editorial review sufficient. Strong alignment; review success-aridity relation without forcing all ten stages.
