feature,cultural_function,preservation_strength,context_need,notes
Performance,Embodied meaning and audience response,0.82,high,Voice gesture occasion and setting shape meaning
Repetition,Memory support and recognition,0.88,medium,Repeated forms may carry cultural significance
Variation,Adaptation across tellers and occasions,0.76,high,Variation should not automatically be treated as error
Formula,Composition and recall support,0.80,medium,Formulaic pattern can be sophisticated
Communal authority,Shared cultural ownership,0.78,high,Permission and cultural protocol may matter
Occasion,Ritual teaching mourning celebration or law,0.84,high,Occasion determines interpretation
