item,transmission_pathway,language_status,apprenticeship_note
Intergenerational folktale practice,family gatherings and elder storytelling,stable but needs youth engagement,Create youth teller sessions
Ritual chant recording,ceremonial role transmission,restricted specialist language,Training and access require protocol
Community legend archive,community archive workshops and place walks,local language elements present,Connect archive to guided local learning
Digital platform story collection,platform upload and remote viewing,fragmented language metadata,Transmission pathway weak and platform-dependent
Language revitalization storytelling workshop,community-led workshops and school partnerships,revitalization priority,Strong apprentice and learner model
