item,memory_support_type,formula_or_repetition,transmission_note
Repeated family story,family repetition,repeated phrases and scenes,Memory distributed through family correction
Festival folktale performance,public performance formula,opening and closing formulas,Audience response supports recognition
Ritual story omission,restricted ritual memory,formal sequence and guarded silence,Omission may be protocol not error
Digital clip of local legend,weak digital memory support,clip repetition and comments,Platform metrics may reshape memory
Translated folktale variant,textualized memory support,translated repeated motifs,Translation may hide original formulas
