item,claim_context,fragmentation_sensitivity,witness_care,trauma_narrative_risk,interpretation_readiness,governance_priority_score,review_priority,owner,status,governance_note
Institutional apology,closure language accountability and public repair audit,0.63,0.55,0.6916,0.7267,0.62,high,governance,revise,"High-priority fragmented-narrative governance review required. Trauma-narrative risk is elevated; review forced coherence, redemptive shortcut, extraction risk, identity reduction, and spectacle pressure. Witness-care signals are limited; strengthen consent, agency, privacy, relational context, safety framing, and boundary discipline. Escalate premature closure and institutional self-protection."
Digital trauma circulation,viral testimony context collapse and platform risk audit,0.7267,0.6033,0.6784,0.8033,0.5523,medium,governance,review,"Medium-priority review recommended before reuse. Trauma-narrative risk is elevated; review forced coherence, redemptive shortcut, extraction risk, identity reduction, and spectacle pressure. Witness-care signals are limited; strengthen consent, agency, privacy, relational context, safety framing, and boundary discipline. Review consent reuse harassment algorithmic amplification and context collapse."
Survivor testimony,fragmented witness memory and consent audit,0.8567,0.8633,0.458,0.86,0.45,medium,ethics review,review,Medium-priority review recommended before reuse. Protect witness dignity and avoid forcing complete chronology.
Nonlinear trauma memoir,memory gaps repetition and narrative form audit,0.8533,0.79,0.414,0.8367,0.3725,standard,editorial,active,Standard editorial review sufficient. Strong formal fragmentation with standard ethical review.
Family silence,intergenerational memory silence and inherited trauma audit,0.8167,0.8,0.416,0.8333,0.3687,standard,editorial,active,Standard editorial review sufficient. Review silence as relational historical and protective rather than empty.
