"item","source_type","source_context","documentation_note","pattern_feature","fit_note","specificity_focus","review_note"
"Ancient hero myth","traditional myth","source tradition and ritual history required","Compare only after documenting source context","departure threshold ordeal return","Moderate fit but source tradition remains primary","language ritual and source tradition","Strong context notes required before comparison"
"Corporate hero branding","institutional story","brand and leadership narrative","Review power masking and false heroism","manufactured hero pattern","High formula and ethics risk","power and institutional messaging","Review manipulation and context loss"
"Heroine-centered narrative","alternative narrative structure","gendered narrative critique","Compare with heroine journey and relational frameworks","partial or resistant fit","Alternative transformation model needed","gendered structure and embodiment","Avoid judging by male-coded quest model"
"Indigenous place-based story","oral tradition and place memory","community authority and access protocol required","Do not force into hero journey","low fit to Campbell pattern","Place relation and oral context are more important","land oral tradition and community authority","High sensitivity and access review required"
"Modern film hero arc","popular media","film and screenwriting context","Campbell can be useful but formula risk is high","high hero journey fit","Useful for media analysis with formula caution","genre and media context","Public media can be analyzed with lighter cultural risk"
