"item","primary_symbolic_function","secondary_function","interpretive_note","ritual_context","ritual_elements","context_note","power_issue","authority_note","review_note"
"Appropriated ritual symbol","detached symbol reuse","commercial extraction","Requires authority and access review","commercial adaptation","symbol use without ritual authority","High-risk context removal","authority absent or unclear","appropriated from source tradition","Requires governance escalation"
"Corporate origin story","founder authority and institutional mission","employee identity","Review branding myth and institutional power","institutional ritual","onboarding awards launch events and founder narrative","Review how ritual stages legitimacy","institutional legitimacy","founder executive or brand authority","Review mission myth and employee identity"
"Creation story and renewal festival","origin and cosmic order","renewal and obligation","Interpret creation as orientation not failed science","ritual calendar renewal","sequence place objects participants and sacred time","Document festival context and renewal logic","sacred order and communal obligation","community or tradition authority","Respect source context"
"Initiation rite","threshold and transformation","identity and role change","Track separation liminality and return","threshold ritual","separation ordeal instruction naming and return","Review access protocol and cultural authority","role transition and restricted authority","ritual specialists or elders","Access controls likely required"
"National founding myth","identity and authority","memory and public emotion","Review exclusion and totalizing risk","civic ritual","flags memorials oaths speeches and public gathering","Analyze power belonging and exclusion","national identity and public legitimacy","state and civic authority","Review excluded memories and scapegoating risk"
