item,claim_context,tragic_structure,cyclical_structure,non_heroic_agency,heroic_overfit_risk,review_readiness,governance_priority_score,review_priority,owner,status,governance_note
Ecological cycle,feedback delay threshold and recurrence audit,0.77,0.83,0.69,0.6812,0.876,0.6412,high,governance,revise,"High-priority non-heroic narrative governance review required. Heroic-overfit risk is elevated. Review hero forcing, victory pressure, closure pressure, return pressure, growth pressure, and evidence visibility. Non-heroic agency is strong. Preserve care, endurance, witness, refusal, maintenance, and survival as narrative action. Cyclical structure is strong. Preserve recurrence, ritual, generational, institutional, ecological, and variation patterns. Tragic structure is strong. Preserve consequence, limit, reversal, recognition, irreversibility, and witness burden. Escalate systemic and ecological cycle review. Avoid forcing single protagonist solution."
Institutional tragedy,distributed responsibility and delayed recognition audit,0.8433,0.6233,0.5933,0.648,0.86,0.6313,high,governance,review,"High-priority non-heroic narrative governance review required. Heroic-overfit risk is elevated. Review hero forcing, victory pressure, closure pressure, return pressure, growth pressure, and evidence visibility. Tragic structure is strong. Preserve consequence, limit, reversal, recognition, irreversibility, and witness burden. Preserve institutional pattern and avoid reducing tragedy to individual flaw."
Caregiving memoir,care endurance and maintenance agency audit,0.59,0.6033,0.8333,0.6696,0.848,0.6205,high,ethics review,review,"High-priority non-heroic narrative governance review required. Heroic-overfit risk is elevated. Review hero forcing, victory pressure, closure pressure, return pressure, growth pressure, and evidence visibility. Non-heroic agency is strong. Preserve care, endurance, witness, refusal, maintenance, and survival as narrative action. Preserve care and maintenance as primary narrative action."
Witness narrative,testimony memory and refusal of false closure audit,0.7767,0.6167,0.79,0.6616,0.896,0.6129,medium,ethics review,review,"Medium-priority review recommended before reuse. Heroic-overfit risk is elevated. Review hero forcing, victory pressure, closure pressure, return pressure, growth pressure, and evidence visibility. Non-heroic agency is strong. Preserve care, endurance, witness, refusal, maintenance, and survival as narrative action. Tragic structure is strong. Preserve consequence, limit, reversal, recognition, irreversibility, and witness burden. Protect testimony from cathartic smoothing or entertainment framing."
Family cycle,generational recurrence and attempted repair audit,0.6967,0.71,0.7567,0.6584,0.852,0.6068,medium,editorial,review,"Medium-priority review recommended before reuse. Heroic-overfit risk is elevated. Review hero forcing, victory pressure, closure pressure, return pressure, growth pressure, and evidence visibility. Non-heroic agency is strong. Preserve care, endurance, witness, refusal, maintenance, and survival as narrative action. Cyclical structure is strong. Preserve recurrence, ritual, generational, institutional, ecological, and variation patterns. Tragic structure is strong. Preserve consequence, limit, reversal, recognition, irreversibility, and witness burden. Preserve recurrence and variation instead of converting cycle into one-time growth arc."
